{
  "id": "zukou-052",
  "collection_id": "zukou",
  "number": 52,
  "title": null,
  "author": "伊藤看寿",
  "published_year": 1755,
  "period": "Edo",
  "sfen": "9/9/4p4/6nl1/2+p1S+r3/3LS2Gs/6kpB/2G4+p+B/4N+R3 b 2N2gs2l14p 1",
  "corrected_sfen": null,
  "correction_note": null,
  "solution_usi": [
    "N*2i",
    "2h2i",
    "1h1i",
    "2g2h+",
    "1i2h",
    "2i2h",
    "P*3h",
    "2h3h",
    "5e4f",
    "4e4f",
    "4i4f",
    "3g4f",
    "R*4b",
    "4f5f",
    "7h6g",
    "5f5e",
    "5i4g",
    "5e5d",
    "N*4f",
    "3d4f",
    "4b4e+",
    "5d4e",
    "2f3e",
    "4e5d",
    "3e4d"
  ],
  "solution_moves": 25,
  "status": {
    "position_verified": true,
    "solution_verified": true,
    "unique_solution_verified": false
  },
  "verification": {
    "method": "reference-KIF collation + engine check: SFEN parse, inventory, nifu, full solution legality with continuous check, final mate with complete reply generation (tools/validate.py)",
    "tool": "tools/kif2open.py + tools/validate.py",
    "checked_date": "2026-09-16",
    "transcribed_by": "edo_era_tsume_shogi maintainers",
    "transcribed_from": "Stage-1 reference transcription (board facts and main-line moves only, mechanically transcribed; third-party reference, URL withheld per project policy). Original archive scans NOT yet collated.",
    "transcribed_date": "2026-09-15",
    "reference_urls": [],
    "needs_manual_review": true
  },
  "source": {
    "title": "将棋図巧",
    "repository": "国立国会図書館",
    "identifier": "NDLBibID:000000493927 / 請求記号:209-461",
    "page": "NDL PID:861211 R0000017右 丁14裏 題簽「五十二番」",
    "url": "https://ndlsearch.ndl.go.jp/books/R100000002-I000000493927",
    "edition": null
  },
  "rights": {
    "original_work": "Public Domain",
    "dataset_record": "CC0-1.0"
  },
  "features": {},
  "notes": [
    "参考KIFの申告手数: 25手",
    "本レコードの盤面・解答は照合用参考KIFからの機械的転記であり、原典（NDL所蔵『将棋図巧・将棋図巧詰手』）画像との照合は未了。参考資料の解説文・着想点等は一切取り込んでいない。",
    "解説：桂打・歩打の端攻めから中央の飛打へ展開し、飛の成りで収束に向かう流れと見られる。香桂の捨て駒で応手を限定する構成と見られる。原典照合未了のため主題の断定は留保する。"
  ]
}
