{
  "id": "musou-039",
  "collection_id": "musou",
  "number": 39,
  "title": null,
  "author": "三代伊藤宗看",
  "published_year": 1734,
  "period": "Edo",
  "sfen": "9/3+Rr4/4pp3/2kp5/4P4/4+b4/P3S4/2S2L3/9 b 3Gbg2s4n3l13p 1",
  "corrected_sfen": null,
  "correction_note": null,
  "solution_usi": [
    "G*7e",
    "7d7e",
    "6b7c",
    "G*7d",
    "G*6f",
    "5f6f",
    "5g6f",
    "7e6f",
    "B*7e",
    "6f5e",
    "7e6d",
    "5e6e",
    "P*6f",
    "6e6f",
    "6d7e",
    "6f7e",
    "G*7f",
    "7e7f",
    "7c7d",
    "7f6f",
    "7d6d",
    "6f5g",
    "G*4g",
    "5g5h",
    "6d6i"
  ],
  "solution_moves": 25,
  "status": {
    "position_verified": true,
    "solution_verified": true,
    "unique_solution_verified": false
  },
  "verification": {
    "method": "reference-KIF collation + engine check: SFEN parse, inventory, nifu, full solution legality with continuous check, final mate with complete reply generation (tools/validate.py)",
    "tool": "tools/kif2open.py + tools/validate.py",
    "checked_date": "2026-09-16",
    "transcribed_by": "open-tsume maintainers",
    "transcribed_from": "mechanical transcription of board facts and main-line moves from collation-reference KIF (http://park6.wakwak.com/~k-oohasi/shougi/html/musou/musou00.html); original archive scans NOT yet collated",
    "transcribed_date": "2026-09-15",
    "reference_urls": [
      "http://park6.wakwak.com/~k-oohasi/shougi/html/musou/musou00.html"
    ],
    "needs_manual_review": true
  },
  "source": {
    "title": "象戯作物（俗称：将棋無双）",
    "repository": "国立国会図書館",
    "identifier": "NDLBibID:000001281469 / 請求記号:W431-4（享保19年版の復製）",
    "page": null,
    "url": "https://ndlsearch.ndl.go.jp/books/R100000002-I000001281469",
    "edition": "享保19年版の復製（1970年古棋書復刻委員会版）。伝本により図に異同あり。未照合。"
  },
  "rights": {
    "original_work": "Public Domain",
    "dataset_record": "CC0-1.0"
  },
  "features": {},
  "notes": [
    "参考KIFの申告手数: 25手",
    "本レコードの盤面・解答は照合用参考KIFからの機械的転記であり、原典（NDL所蔵『象戯作物』享保19年版の復製）画像との照合は未了。参考資料の解説文等は一切取り込んでいない。無双は伝本により図に異同があることが知られており、版の特定も今後の課題。"
  ]
}
