{
  "id": "musou-034",
  "collection_id": "musou",
  "number": 34,
  "title": null,
  "author": "三代伊藤宗看",
  "published_year": 1734,
  "period": "Edo",
  "sfen": "2B2l1S1/2r3R1s/4n+Bnp1/4gG2k/6p1s/6n2/9/9/9 b GNLgs2l16p 1",
  "corrected_sfen": null,
  "correction_note": null,
  "solution_usi": [
    "G*2d",
    "2c2d",
    "3b1b+",
    "7b1b",
    "S*2c",
    "1d2c",
    "2a1b",
    "2c1d",
    "R*1c",
    "1d1c",
    "N*2e",
    "1c1d",
    "1b2c",
    "1d2c",
    "4c3b",
    "2c3b",
    "4d3c",
    "3b3a",
    "7a5c+",
    "5d5c",
    "N*2c",
    "3a2a",
    "N*1c",
    "2a1b",
    "2c1a+",
    "1b1a",
    "1c2a+",
    "1a2a",
    "L*2c",
    "2a3a",
    "2c2b+"
  ],
  "solution_moves": 31,
  "status": {
    "position_verified": true,
    "solution_verified": true,
    "unique_solution_verified": false
  },
  "verification": {
    "method": "reference-KIF collation + engine check: SFEN parse, inventory, nifu, full solution legality with continuous check, final mate with complete reply generation (tools/validate.py)",
    "tool": "tools/kif2open.py + tools/validate.py",
    "checked_date": "2026-09-16",
    "transcribed_by": "edo_era_tsume_shogi maintainers",
    "transcribed_from": "Stage-1 reference transcription (board facts and main-line moves only, mechanically transcribed; third-party reference, URL withheld per project policy). Original archive scans NOT yet collated.",
    "transcribed_date": "2026-09-15",
    "reference_urls": [],
    "needs_manual_review": true
  },
  "source": {
    "title": "象戯作物（俗称：将棋無双）",
    "repository": "国立国会図書館",
    "identifier": "NDLBibID:000001281469 / 請求記号:W431-4（享保19年版の復製）",
    "page": null,
    "url": "https://ndlsearch.ndl.go.jp/books/R100000002-I000001281469",
    "edition": "享保19年版の復製（1970年古棋書復刻委員会版）。伝本により図に異同あり。未照合。"
  },
  "rights": {
    "original_work": "Public Domain",
    "dataset_record": "CC0-1.0"
  },
  "features": {},
  "notes": [
    "参考KIFの申告手数: 31手",
    "本レコードの盤面・解答は照合用参考KIFからの機械的転記であり、原典（NDL所蔵『象戯作物』享保19年版の復製）画像との照合は未了。参考資料の解説文等は一切取り込んでいない。無双は伝本により図に異同があることが知られており、版の特定も今後の課題。"
  ]
}
