{
  "id": "musou-092",
  "collection_id": "musou",
  "number": 92,
  "title": null,
  "author": "三代伊藤宗看",
  "published_year": 1734,
  "period": "Edo",
  "sfen": "5pg2/7P+L/5n3/3+R5/4l1pp1/2p1pg3/3+p1S1B1/1+l3P3/4k1s2 b B2G2SPr3nl9p 1",
  "corrected_sfen": null,
  "correction_note": null,
  "solution_usi": [
    "G*5h",
    "6g5h",
    "G*4i",
    "5h4i",
    "S*6h",
    "5i4h",
    "6h5i",
    "4h5i",
    "B*4h",
    "5i4h",
    "6d6h",
    "4h3g",
    "4g4f",
    "3g2g",
    "G*3g",
    "2g1g",
    "S*1h",
    "1g1f",
    "1h2g",
    "1f1e",
    "6h1h",
    "1e2d",
    "1h1c",
    "2d3d",
    "4f4e",
    "3d4e",
    "1c4c",
    "S*4d",
    "2g3f",
    "3e3f",
    "P*4f",
    "4e3e",
    "N*2g",
    "3e2d",
    "4c4d",
    "L*3d",
    "S*3e",
    "2d2c",
    "4d3d",
    "2c1b",
    "L*1d",
    "1b2b",
    "1d1c+",
    "2b1c",
    "3e2d",
    "1c2b",
    "2d2c+",
    "2b2a",
    "3d3a",
    "2a3a",
    "G*3b"
  ],
  "solution_moves": 51,
  "status": {
    "position_verified": true,
    "solution_verified": true,
    "unique_solution_verified": false
  },
  "verification": {
    "method": "reference-KIF collation + engine check: SFEN parse, inventory, nifu, full solution legality with continuous check, final mate with complete reply generation (tools/validate.py) + solver crosscheck (YaneuraOuMateEngine 9.80git): 完全解探索で61手（現記録51手と不一致）、solution_usi不変",
    "tool": "tools/kif2open.py + tools/validate.py",
    "checked_date": "2026-09-16",
    "transcribed_by": "edo_era_tsume_shogi maintainers",
    "transcribed_from": "Stage-1 reference transcription (board facts and main-line moves only, mechanically transcribed; third-party reference, URL withheld per project policy). Original archive scans NOT yet collated.",
    "transcribed_date": "2026-09-15",
    "reference_urls": [],
    "needs_manual_review": true
  },
  "source": {
    "title": "象戯作物（俗称：将棋無双）",
    "repository": "国立国会図書館",
    "identifier": "NDLBibID:000001281469 / 請求記号:W431-4（享保19年版の復製）",
    "page": null,
    "url": "https://ndlsearch.ndl.go.jp/books/R100000002-I000001281469",
    "edition": "享保19年版の復製（1970年古棋書復刻委員会版）。伝本により図に異同あり。未照合。"
  },
  "rights": {
    "original_work": "Public Domain",
    "dataset_record": "CC0-1.0"
  },
  "features": {},
  "notes": [
    "参考KIFの申告手数: 51手",
    "本レコードの盤面・解答は照合用参考KIFからの機械的転記であり、原典（NDL所蔵『象戯作物』享保19年版の復製）画像との照合は未了。参考資料の解説文等は一切取り込んでいない。無双は伝本により図に異同があることが知られており、版の特定も今後の課題。",
    "solver crosscheck (YaneuraOuMateEngine 9.80git): 完全解探索で61手（現記録51手と不一致）。solution_usi不変。",
    "解説：51手の手順で、序盤は金・銀連打（G*5h・G*4i・S*6h）から角打ち（B*4h）の捨て合いへ進むと見られる。中盤は飛・角の転換と香打ち（L*1d）を交えると見られる。終盤は銀成・香成の連携から金打ち（G*3b）で収束すると見られ、原典照合未了のため主題の断定は留保する。"
  ]
}
