{
  "id": "musou-042",
  "collection_id": "musou",
  "number": 42,
  "title": null,
  "author": "三代伊藤宗看",
  "published_year": 1734,
  "period": "Edo",
  "sfen": "2s3S2/9/+b4L2P/1+P1Lk1P2/1s1P4p/3pB1Np1/+R8/2p+lNP1+p1/3N5 b NLr4gs8p 1",
  "corrected_sfen": null,
  "correction_note": null,
  "solution_usi": [
    "L*5e",
    "5d5e",
    "N*4g",
    "5e5f",
    "9g5g",
    "5f4e",
    "5g4f",
    "4e3d",
    "4f3e",
    "3d4c",
    "3e4d",
    "4c3b",
    "4d4b",
    "3b2c",
    "4b2b",
    "2c3d",
    "2b2d",
    "3d4e",
    "2d3e",
    "4e5f",
    "3e5e",
    "5f6g",
    "5e5g",
    "6g7f",
    "5g7g",
    "7f6e",
    "6i5g",
    "6e5d",
    "5h4f",
    "5d4c",
    "4g3e",
    "4c3b",
    "3f2d",
    "3b3c",
    "7g7c",
    "3c2d",
    "7c2c",
    "2d3e",
    "2c3d",
    "3e4f",
    "3d4e",
    "4f5g",
    "4e4g"
  ],
  "solution_moves": 43,
  "status": {
    "position_verified": true,
    "solution_verified": true,
    "unique_solution_verified": false
  },
  "verification": {
    "method": "reference-KIF collation + engine check: SFEN parse, inventory, nifu, full solution legality with continuous check, final mate with complete reply generation (tools/validate.py)",
    "tool": "tools/kif2open.py + tools/validate.py",
    "checked_date": "2026-09-16",
    "transcribed_by": "edo_era_tsume_shogi maintainers",
    "transcribed_from": "Stage-1 reference transcription (board facts and main-line moves only, mechanically transcribed; third-party reference, URL withheld per project policy). Original archive scans NOT yet collated.",
    "transcribed_date": "2026-09-15",
    "reference_urls": [],
    "needs_manual_review": true
  },
  "source": {
    "title": "象戯作物（俗称：将棋無双）",
    "repository": "国立国会図書館",
    "identifier": "NDLBibID:000001281469 / 請求記号:W431-4（享保19年版の復製）",
    "page": null,
    "url": "https://ndlsearch.ndl.go.jp/books/R100000002-I000001281469",
    "edition": "享保19年版の復製（1970年古棋書復刻委員会版）。伝本により図に異同あり。未照合。"
  },
  "rights": {
    "original_work": "Public Domain",
    "dataset_record": "CC0-1.0"
  },
  "features": {},
  "notes": [
    "参考KIFの申告手数: 43手",
    "本レコードの盤面・解答は照合用参考KIFからの機械的転記であり、原典（NDL所蔵『象戯作物』享保19年版の復製）画像との照合は未了。参考資料の解説文等は一切取り込んでいない。無双は伝本により図に異同があることが知られており、版の特定も今後の課題。"
  ]
}
