{
  "id": "zukou-002",
  "collection_id": "zukou",
  "number": 2,
  "title": null,
  "author": "伊藤看寿",
  "published_year": 1755,
  "period": "Edo",
  "sfen": "9/9/3B3G1/6+p1n/7+p1/7k1/5BL1p/7G1/7+R+r b N2P2g4s2n3l13p 1",
  "corrected_sfen": null,
  "correction_note": null,
  "solution_usi": [
    "2h2g",
    "2f1e",
    "2g1f",
    "2e1f",
    "N*2g",
    "1f2g",
    "P*1f",
    "1e1f",
    "4g2e",
    "1f2e",
    "6c3f+",
    "2e1e",
    "P*1f",
    "1e1f",
    "2i2g",
    "1f1e",
    "3f2e",
    "3d2e",
    "P*1f",
    "2e1f",
    "2g2d"
  ],
  "solution_moves": 21,
  "status": {
    "position_verified": true,
    "solution_verified": true,
    "unique_solution_verified": false
  },
  "verification": {
    "method": "reference-KIF collation + engine check: SFEN parse, inventory, nifu, full solution legality with continuous check, final mate with complete reply generation (tools/validate.py)",
    "tool": "tools/kif2open.py + tools/validate.py",
    "checked_date": "2026-09-15",
    "transcribed_by": "open-tsume maintainers",
    "transcribed_from": "国立国会図書館『将棋図巧・将棋図巧詰手』(NDLBibID:000000493927), collated via reference KIF",
    "transcribed_date": "2026-09-15",
    "reference_urls": [
      "http://park6.wakwak.com/~k-oohasi/shougi/html/zukou/zukou01.html"
    ],
    "needs_manual_review": true
  },
  "source": {
    "title": "将棋図巧",
    "repository": "国立国会図書館",
    "identifier": "NDLBibID:000000493927 / 請求記号:209-461",
    "page": null,
    "url": "https://ndlsearch.ndl.go.jp/books/R100000002-I000000493927",
    "edition": null
  },
  "rights": {
    "original_work": "Public Domain",
    "dataset_record": "CC0-1.0"
  },
  "features": {},
  "notes": [
    "参考KIFの申告手数: 21手"
  ]
}
