{
  "id": "musou-035",
  "collection_id": "musou",
  "number": 35,
  "title": null,
  "author": "三代伊藤宗看",
  "published_year": 1734,
  "period": "Edo",
  "sfen": "4p4/n1s+B5/sR1n5/k8/3P5/2s+p5/sNP6/9/9 b RB4gn4l14p 1",
  "corrected_sfen": null,
  "correction_note": null,
  "solution_usi": [
    "B*8e",
    "7f8e",
    "R*7d",
    "8e7d",
    "8c8e+",
    "7d8e",
    "6b7b",
    "9d8d",
    "S*7c",
    "8d7d",
    "7c6d+",
    "7d8d",
    "7b7c",
    "8d9d",
    "7c9e",
    "9d8c",
    "6d7c"
  ],
  "solution_moves": 17,
  "status": {
    "position_verified": true,
    "solution_verified": true,
    "unique_solution_verified": false
  },
  "verification": {
    "method": "reference-KIF collation + engine check: SFEN parse, inventory, nifu, full solution legality with continuous check, final mate with complete reply generation (tools/validate.py)",
    "tool": "tools/kif2open.py + tools/validate.py",
    "checked_date": "2026-09-16",
    "transcribed_by": "open-tsume maintainers",
    "transcribed_from": "mechanical transcription of board facts and main-line moves from collation-reference KIF (http://park6.wakwak.com/~k-oohasi/shougi/html/musou/musou00.html); original archive scans NOT yet collated",
    "transcribed_date": "2026-09-15",
    "reference_urls": [
      "http://park6.wakwak.com/~k-oohasi/shougi/html/musou/musou00.html"
    ],
    "needs_manual_review": true
  },
  "source": {
    "title": "象戯作物（俗称：将棋無双）",
    "repository": "国立国会図書館",
    "identifier": "NDLBibID:000001281469 / 請求記号:W431-4（享保19年版の復製）",
    "page": null,
    "url": "https://ndlsearch.ndl.go.jp/books/R100000002-I000001281469",
    "edition": "享保19年版の復製（1970年古棋書復刻委員会版）。伝本により図に異同あり。未照合。"
  },
  "rights": {
    "original_work": "Public Domain",
    "dataset_record": "CC0-1.0"
  },
  "features": {},
  "notes": [
    "参考KIFの申告手数: 17手",
    "本レコードの盤面・解答は照合用参考KIFからの機械的転記であり、原典（NDL所蔵『象戯作物』享保19年版の復製）画像との照合は未了。参考資料の解説文等は一切取り込んでいない。無双は伝本により図に異同があることが知られており、版の特定も今後の課題。"
  ]
}
