{
  "id": "zukou-084",
  "collection_id": "zukou",
  "number": 84,
  "title": null,
  "author": "伊藤看寿",
  "published_year": 1755,
  "period": "Edo",
  "sfen": "2G1gr3/+R1+P1g4/sp2k1+P2/2S2pp2/3np4/+pN1lS1S2/1+b7/6B2/9 b NPgn3l10p 1",
  "corrected_sfen": null,
  "correction_note": null,
  "solution_usi": [
    "9b8c",
    "P*6c",
    "P*5d",
    "5c6d",
    "5f6e",
    "8g6e",
    "N*5f",
    "6e5f",
    "7d6e",
    "5f6e",
    "8c7c",
    "6d5d",
    "3h6e",
    "5d6e",
    "B*8c",
    "6e5d",
    "N*4f",
    "5d5c",
    "7c6b",
    "5b6b",
    "P*5d",
    "5c5b",
    "7b6b",
    "5a6b",
    "8c6a+",
    "6b6a",
    "G*5c",
    "5b5a",
    "7a6a",
    "5a6a",
    "G*6b"
  ],
  "solution_moves": 31,
  "status": {
    "position_verified": true,
    "solution_verified": true,
    "unique_solution_verified": false
  },
  "verification": {
    "method": "reference-KIF collation + engine check: SFEN parse, inventory, nifu, full solution legality with continuous check, final mate with complete reply generation (tools/validate.py) + solver crosscheck (YaneuraOuMateEngine 9.80git): 完全解探索で33手（現記録31手と不一致）。solution_usi不変。",
    "tool": "tools/kif2open.py + tools/validate.py",
    "checked_date": "2026-09-16",
    "transcribed_by": "edo_era_tsume_shogi maintainers",
    "transcribed_from": "Stage-1 reference transcription (board facts and main-line moves only, mechanically transcribed; third-party reference, URL withheld per project policy). Original archive scans NOT yet collated.",
    "transcribed_date": "2026-09-15",
    "reference_urls": [],
    "needs_manual_review": true
  },
  "source": {
    "title": "将棋図巧",
    "repository": "国立国会図書館",
    "identifier": "NDLBibID:000000493927 / 請求記号:209-461",
    "page": null,
    "url": "https://ndlsearch.ndl.go.jp/books/R100000002-I000000493927",
    "edition": null
  },
  "rights": {
    "original_work": "Public Domain",
    "dataset_record": "CC0-1.0"
  },
  "features": {},
  "notes": [
    "参考KIFの申告手数: 31手",
    "本レコードの盤面・解答は照合用参考KIFからの機械的転記であり、原典（NDL所蔵『将棋図巧・将棋図巧詰手』）画像との照合は未了。参考資料の解説文・着想点等は一切取り込んでいない。",
    "solver crosscheck (YaneuraOuMateEngine 9.80git): 完全解探索で33手（現記録31手と不一致）。solution_usi不変。",
    "解説：歩打・桂打の捨て駒から角の走りと銀打へ展開する流れと見られる。後段は角成・金打の継ぎで収束すると見られる。原典照合未了のため主題の断定は留保する。"
  ]
}
