{
  "id": "zukou-023",
  "collection_id": "zukou",
  "number": 23,
  "title": null,
  "author": "伊藤看寿",
  "published_year": 1755,
  "period": "Edo",
  "sfen": "4g4/1Slg1+P3/+rs1kp4/1L2s4/p+R1s5/2N6/9/9/9 b 2BN2g2n2l15p 1",
  "corrected_sfen": null,
  "correction_note": null,
  "solution_usi": [
    "B*7d",
    "6e7d",
    "8e6e",
    "7d6e",
    "B*8e",
    "7b7d",
    "N*7e",
    "6c7b",
    "7e8c+",
    "7b6a",
    "S*7b",
    "6b7b",
    "8c7b",
    "6a7b",
    "8e9d",
    "9c9d",
    "G*7c",
    "7b6a",
    "8b7a+",
    "6a7a",
    "8d8b+",
    "7a6a",
    "8b7b"
  ],
  "solution_moves": 23,
  "status": {
    "position_verified": true,
    "solution_verified": true,
    "unique_solution_verified": false
  },
  "verification": {
    "method": "reference-KIF collation + engine check: SFEN parse, inventory, nifu, full solution legality with continuous check, final mate with complete reply generation (tools/validate.py)",
    "tool": "tools/kif2open.py + tools/validate.py",
    "checked_date": "2026-09-16",
    "transcribed_by": "edo_era_tsume_shogi maintainers",
    "transcribed_from": "Stage-1 reference transcription (board facts and main-line moves only, mechanically transcribed; third-party reference, URL withheld per project policy). Original archive scans NOT yet collated.",
    "transcribed_date": "2026-09-15",
    "reference_urls": [],
    "needs_manual_review": true
  },
  "source": {
    "title": "将棋図巧",
    "repository": "国立国会図書館",
    "identifier": "NDLBibID:000000493927 / 請求記号:209-461",
    "page": null,
    "url": "https://ndlsearch.ndl.go.jp/books/R100000002-I000000493927",
    "edition": null
  },
  "rights": {
    "original_work": "Public Domain",
    "dataset_record": "CC0-1.0"
  },
  "features": {},
  "notes": [
    "参考KIFの申告手数: 23手",
    "本レコードの盤面・解答は照合用参考KIFからの機械的転記であり、原典（NDL所蔵『将棋図巧・将棋図巧詰手』）画像との照合は未了。参考資料の解説文・着想点等は一切取り込んでいない。"
  ]
}
