{
  "id": "zukou-003",
  "collection_id": "zukou",
  "number": 3,
  "title": null,
  "author": "伊藤看寿",
  "published_year": 1755,
  "period": "Edo",
  "sfen": "2p1g+P3/1P1p1pp2/l1P1g1S+r1/P1B1P1+p2/1p3l3/1kN6/9/2+B6/1r7 b GS2N2Pg2sn2l5p 1",
  "corrected_sfen": null,
  "correction_note": null,
  "solution_usi": [
    "S*7g",
    "8f9e",
    "G*9f",
    "9e9d",
    "N*8f",
    "8i8f",
    "9f8e",
    "8f8e",
    "P*9e",
    "9d9e",
    "P*9f",
    "9e9d",
    "N*8f",
    "8e8f",
    "9f9e",
    "9d9e",
    "7g8f",
    "9e8f",
    "R*8c",
    "8f7f",
    "8c8e+",
    "7f6f",
    "8e5e",
    "6f5e",
    "7h5f",
    "5e6d",
    "5f6e",
    "6d7c",
    "7d8c+",
    "7c6c",
    "6e7d",
    "6c5d",
    "7d6e",
    "5d6c",
    "8c7d",
    "6c7b",
    "P*7c",
    "7b6a",
    "6e4c",
    "4b4c",
    "4a5a",
    "6a5a",
    "7d4a",
    "5a4a",
    "G*4b"
  ],
  "solution_moves": 45,
  "status": {
    "position_verified": true,
    "solution_verified": true,
    "unique_solution_verified": false
  },
  "verification": {
    "method": "reference-KIF collation + engine check: SFEN parse, inventory, nifu, full solution legality with continuous check, final mate with complete reply generation (tools/validate.py) + solver crosscheck (YaneuraOuMateEngine 9.80git): 完全解探索で55手（現記録45手と不一致）。solution_usi不変。",
    "tool": "tools/kif2open.py + tools/validate.py",
    "checked_date": "2026-09-15",
    "transcribed_by": "edo_era_tsume_shogi maintainers",
    "transcribed_from": "Stage-1 reference transcription (board facts and main-line moves only, mechanically transcribed; third-party reference, URL withheld per project policy). Original archive scans NOT yet collated.",
    "transcribed_date": "2026-09-15",
    "reference_urls": [],
    "needs_manual_review": true
  },
  "source": {
    "title": "将棋図巧",
    "repository": "国立国会図書館",
    "identifier": "NDLBibID:000000493927 / 請求記号:209-461",
    "page": null,
    "url": "https://ndlsearch.ndl.go.jp/books/R100000002-I000000493927",
    "edition": null
  },
  "rights": {
    "original_work": "Public Domain",
    "dataset_record": "CC0-1.0"
  },
  "features": {},
  "notes": [
    "参考KIFの申告手数: 45手",
    "本レコードの盤面・解答は照合用参考KIFからの機械的転記であり、原典（NDL所蔵『将棋図巧・将棋図巧詰手』）画像との照合は未了。参考資料の解説文・着想点等は一切取り込んでいない。",
    "solver crosscheck (YaneuraOuMateEngine 9.80git): 完全解探索で55手（現記録45手と不一致）。solution_usi不変。",
    "解説：銀・金・桂の打駒から入り、歩の突き捨てと取合いで玉を誘い出す手順と見られる。中盤は飛・角の成り捨てと金銀の連携で追う流れと見られる。終盤は金打による押さえの収束形と見られる。"
  ]
}
