{
  "id": "zukou-050",
  "collection_id": "zukou",
  "number": 50,
  "title": null,
  "author": "伊藤看寿",
  "published_year": 1755,
  "period": "Edo",
  "sfen": "9/9/6n2/8n/6+pl1/7Sn/4+pp1k1/7N1/7s+R b R2B4g2s3l15p 1",
  "corrected_sfen": null,
  "correction_note": null,
  "solution_usi": [
    "B*4e",
    "3c4e",
    "R*3g",
    "4e3g",
    "B*4i",
    "3g4i+",
    "1i1g",
    "2g3h",
    "1g3g"
  ],
  "solution_moves": 9,
  "status": {
    "position_verified": true,
    "solution_verified": true,
    "unique_solution_verified": false
  },
  "verification": {
    "method": "reference-KIF collation + engine check: SFEN parse, inventory, nifu, full solution legality with continuous check, final mate with complete reply generation (tools/validate.py)",
    "tool": "tools/kif2open.py + tools/validate.py",
    "checked_date": "2026-09-16",
    "transcribed_by": "open-tsume maintainers",
    "transcribed_from": "mechanical transcription of board facts and main-line moves from collation-reference KIF (http://park6.wakwak.com/~k-oohasi/shougi/kifu/zukou/zukou050.kif); original archive scans NOT yet collated",
    "transcribed_date": "2026-09-15",
    "reference_urls": [
      "http://park6.wakwak.com/~k-oohasi/shougi/html/zukou/zukou01.html"
    ],
    "needs_manual_review": true
  },
  "source": {
    "title": "将棋図巧",
    "repository": "国立国会図書館",
    "identifier": "NDLBibID:000000493927 / 請求記号:209-461",
    "page": null,
    "url": "https://ndlsearch.ndl.go.jp/books/R100000002-I000000493927",
    "edition": null
  },
  "rights": {
    "original_work": "Public Domain",
    "dataset_record": "CC0-1.0"
  },
  "features": {},
  "notes": [
    "参考KIFの申告手数: 9手",
    "本レコードの盤面・解答は照合用参考KIFからの機械的転記であり、原典（NDL所蔵『将棋図巧・将棋図巧詰手』）画像との照合は未了。参考資料の解説文・着想点等は一切取り込んでいない。"
  ]
}
