{
  "id": "musou-045",
  "collection_id": "musou",
  "number": 45,
  "title": null,
  "author": "三代伊藤宗看",
  "published_year": 1734,
  "period": "Edo",
  "sfen": "7s1/+P1SP5/1nlNs3p/P3l2P1/+p+R1nk4/9/3SPL3/9/2+r6 b 2BN4gl11p 1",
  "corrected_sfen": null,
  "correction_note": null,
  "solution_usi": [
    "B*9i",
    "P*8h",
    "9i8h",
    "7i8h",
    "5g5f",
    "5e6d",
    "B*9g",
    "7c7e",
    "9g7e",
    "8c7e",
    "N*7f",
    "6d7c",
    "8e8c",
    "8h8c",
    "7b8c+",
    "7c8c",
    "R*8d",
    "8c7b",
    "L*7d",
    "7b6c",
    "8d8c+",
    "6c5b",
    "7f6d",
    "5c6d",
    "4g4c+",
    "5b4a",
    "8c8a",
    "N*5a",
    "P*4b",
    "4a3a",
    "8a5a",
    "3a2b",
    "N*3d",
    "2b1b",
    "5a2a",
    "1b2a",
    "S*3b",
    "2a1a",
    "3d2b+",
    "1a2b",
    "2d2c+",
    "2b1a",
    "3b2a+",
    "1a2a",
    "4c3b",
    "2a1a",
    "3b2b"
  ],
  "solution_moves": 47,
  "status": {
    "position_verified": true,
    "solution_verified": true,
    "unique_solution_verified": false
  },
  "verification": {
    "method": "reference-KIF collation + engine check: SFEN parse, inventory, nifu, full solution legality with continuous check, final mate with complete reply generation (tools/validate.py) + solver crosscheck (YaneuraOuMateEngine 9.80git): 完全解探索で53手（現記録47手と不一致）、solution_usi不変",
    "tool": "tools/kif2open.py + tools/validate.py",
    "checked_date": "2026-09-16",
    "transcribed_by": "edo_era_tsume_shogi maintainers",
    "transcribed_from": "Stage-1 reference transcription (board facts and main-line moves only, mechanically transcribed; third-party reference, URL withheld per project policy). Original archive scans NOT yet collated.",
    "transcribed_date": "2026-09-15",
    "reference_urls": [],
    "needs_manual_review": true
  },
  "source": {
    "title": "象戯作物（俗称：将棋無双）",
    "repository": "国立国会図書館",
    "identifier": "NDLBibID:000001281469 / 請求記号:W431-4（享保19年版の復製）",
    "page": null,
    "url": "https://ndlsearch.ndl.go.jp/books/R100000002-I000001281469",
    "edition": "享保19年版の復製（1970年古棋書復刻委員会版）。伝本により図に異同あり。未照合。"
  },
  "rights": {
    "original_work": "Public Domain",
    "dataset_record": "CC0-1.0"
  },
  "features": {},
  "notes": [
    "参考KIFの申告手数: 47手",
    "本レコードの盤面・解答は照合用参考KIFからの機械的転記であり、原典（NDL所蔵『象戯作物』享保19年版の復製）画像との照合は未了。参考資料の解説文等は一切取り込んでいない。無双は伝本により図に異同があることが知られており、版の特定も今後の課題。",
    "solver crosscheck (YaneuraOuMateEngine 9.80git): 完全解探索で53手（現記録47手と不一致）。solution_usi不変。",
    "解説：47手の手順で、B*9iの角捨てから角・桂の捨て継ぎで上部を崩すと見られる。中盤は飛・香の捨駒と歩の連打を交えた追い回しで、後半は銀・桂の打ち直しを経て3b2bで収束する形と見られる。"
  ]
}
