{
  "id": "musou-055",
  "collection_id": "musou",
  "number": 55,
  "title": null,
  "author": "三代伊藤宗看",
  "published_year": 1734,
  "period": "Edo",
  "sfen": "1l7/s8/p+Pg6/3p5/+pP1B5/kp7/2R+p5/S8/9 b GNrb2g2s3n3l11p 1",
  "corrected_sfen": null,
  "correction_note": null,
  "solution_usi": [
    "9h9g",
    "9f8e",
    "9g9f",
    "8e9f",
    "6e7d",
    "7c7d",
    "N*8h",
    "9f8e",
    "7g7e",
    "8e7e",
    "G*7f"
  ],
  "solution_moves": 11,
  "status": {
    "position_verified": true,
    "solution_verified": true,
    "unique_solution_verified": false
  },
  "verification": {
    "method": "reference-KIF collation + engine check: SFEN parse, inventory, nifu, full solution legality with continuous check, final mate with complete reply generation (tools/validate.py) + solver crosscheck (YaneuraOuMateEngine 9.80git): 完全解探索で15手（現記録11手と不一致）、solution_usi不変",
    "tool": "tools/kif2open.py + tools/validate.py",
    "checked_date": "2026-09-16",
    "transcribed_by": "edo_era_tsume_shogi maintainers",
    "transcribed_from": "Stage-1 reference transcription (board facts and main-line moves only, mechanically transcribed; third-party reference, URL withheld per project policy). Original archive scans NOT yet collated.",
    "transcribed_date": "2026-09-15",
    "reference_urls": [],
    "needs_manual_review": true
  },
  "source": {
    "title": "象戯作物（俗称：将棋無双）",
    "repository": "国立国会図書館",
    "identifier": "NDLBibID:000001281469 / 請求記号:W431-4（享保19年版の復製）",
    "page": null,
    "url": "https://ndlsearch.ndl.go.jp/books/R100000002-I000001281469",
    "edition": "享保19年版の復製（1970年古棋書復刻委員会版）。伝本により図に異同あり。未照合。"
  },
  "rights": {
    "original_work": "Public Domain",
    "dataset_record": "CC0-1.0"
  },
  "features": {},
  "notes": [
    "参考KIFの申告手数: 11手",
    "本レコードの盤面・解答は照合用参考KIFからの機械的転記であり、原典（NDL所蔵『象戯作物』享保19年版の復製）画像との照合は未了。参考資料の解説文等は一切取り込んでいない。無双は伝本により図に異同があることが知られており、版の特定も今後の課題。",
    "solver crosscheck (YaneuraOuMateEngine 9.80git): 完全解探索で15手（現記録11手と不一致）。solution_usi不変。",
    "解説：11手の短手数で、序盤は香の往復（9h9g・9g9f）から角の転換へ進むと見られる。中盤は桂打ち（N*8h）と銀の捨駒で玉を隅へ追うと見られる。終盤は金打ち（G*7f）で収束すると見られ、原典照合未了のため主題の断定は留保する。"
  ]
}
