{
  "id": "zukou-062",
  "collection_id": "zukou",
  "number": 62,
  "title": null,
  "author": "伊藤看寿",
  "published_year": 1755,
  "period": "Edo",
  "sfen": "7l+b/9/9/9/6+b2/6G1G/8r/5+p1Sk/5g+p2 b R3Sg4n3l16p 1",
  "corrected_sfen": null,
  "correction_note": null,
  "solution_usi": [
    "1f1g",
    "3e1g",
    "S*1i",
    "1h2i",
    "S*1h",
    "1g1h",
    "1i1h",
    "2i2h",
    "R*2b",
    "1a2b",
    "R*2c",
    "2b2c",
    "B*7c",
    "2h1h",
    "S*1i",
    "1h1g",
    "7c6b+",
    "1g2g",
    "6b2f",
    "2g3h",
    "2f3g",
    "3h2i",
    "3g2h"
  ],
  "solution_moves": 23,
  "status": {
    "position_verified": true,
    "solution_verified": true,
    "unique_solution_verified": false
  },
  "verification": {
    "method": "reference-KIF collation + engine check: SFEN parse, inventory, nifu, full solution legality with continuous check, final mate with complete reply generation (tools/validate.py)",
    "tool": "tools/kif2open.py + tools/validate.py",
    "checked_date": "2026-09-16",
    "transcribed_by": "open-tsume maintainers",
    "transcribed_from": "mechanical transcription of board facts and main-line moves from collation-reference KIF (http://park6.wakwak.com/~k-oohasi/shougi/kifu/zukou/zukou062.kif); original archive scans NOT yet collated",
    "transcribed_date": "2026-09-15",
    "reference_urls": [
      "http://park6.wakwak.com/~k-oohasi/shougi/html/zukou/zukou01.html"
    ],
    "needs_manual_review": true
  },
  "source": {
    "title": "将棋図巧",
    "repository": "国立国会図書館",
    "identifier": "NDLBibID:000000493927 / 請求記号:209-461",
    "page": null,
    "url": "https://ndlsearch.ndl.go.jp/books/R100000002-I000000493927",
    "edition": null
  },
  "rights": {
    "original_work": "Public Domain",
    "dataset_record": "CC0-1.0"
  },
  "features": {},
  "notes": [
    "参考KIFの申告手数: 23手",
    "本レコードの盤面・解答は照合用参考KIFからの機械的転記であり、原典（NDL所蔵『将棋図巧・将棋図巧詰手』）画像との照合は未了。参考資料の解説文・着想点等は一切取り込んでいない。"
  ]
}
