{
  "id": "musou-064",
  "collection_id": "musou",
  "number": 64,
  "title": null,
  "author": "三代伊藤宗看",
  "published_year": 1734,
  "period": "Edo",
  "sfen": "2n6/6g2/5l1L1/3n3l+P/4+r+p3/3P2p2/1+R1Bk3N/7P1/3+p5 b BGS2g3snl12p 1",
  "corrected_sfen": null,
  "correction_note": null,
  "solution_usi": [
    "6g5f",
    "5g4f",
    "8g4g",
    "4f3e",
    "S*2f",
    "2d2f",
    "4g4f",
    "3e4d",
    "B*3e",
    "4d3c",
    "3e2d",
    "3c4d",
    "4f5e",
    "4e5e",
    "2d3e",
    "4d3e",
    "R*3d",
    "3e4f",
    "G*4g"
  ],
  "solution_moves": 19,
  "status": {
    "position_verified": true,
    "solution_verified": true,
    "unique_solution_verified": false
  },
  "verification": {
    "method": "reference-KIF collation + engine check: SFEN parse, inventory, nifu, full solution legality with continuous check, final mate with complete reply generation (tools/validate.py) + solver crosscheck (YaneuraOuMateEngine 9.80git): 完全解探索で31手（現記録19手と不一致）、solution_usi不変",
    "tool": "tools/kif2open.py + tools/validate.py",
    "checked_date": "2026-09-16",
    "transcribed_by": "edo_era_tsume_shogi maintainers",
    "transcribed_from": "Stage-1 reference transcription (board facts and main-line moves only, mechanically transcribed; third-party reference, URL withheld per project policy). Original archive scans NOT yet collated.",
    "transcribed_date": "2026-09-15",
    "reference_urls": [],
    "needs_manual_review": true
  },
  "source": {
    "title": "象戯作物（俗称：将棋無双）",
    "repository": "国立国会図書館",
    "identifier": "NDLBibID:000001281469 / 請求記号:W431-4（享保19年版の復製）",
    "page": null,
    "url": "https://ndlsearch.ndl.go.jp/books/R100000002-I000001281469",
    "edition": "享保19年版の復製（1970年古棋書復刻委員会版）。伝本により図に異同あり。未照合。"
  },
  "rights": {
    "original_work": "Public Domain",
    "dataset_record": "CC0-1.0"
  },
  "features": {},
  "notes": [
    "参考KIFの申告手数: 19手",
    "本レコードの盤面・解答は照合用参考KIFからの機械的転記であり、原典（NDL所蔵『象戯作物』享保19年版の復製）画像との照合は未了。参考資料の解説文等は一切取り込んでいない。無双は伝本により図に異同があることが知られており、版の特定も今後の課題。",
    "solver crosscheck (YaneuraOuMateEngine 9.80git): 完全解探索で31手（現記録19手と不一致）。solution_usi不変。",
    "解説：19手の手順で、序盤は銀上がり（6g5f）から飛の転換（8g4g）へ進むと見られる。中盤は銀捨て（S*2f）と角打ち（B*3e）の連携で寄せると見られる。終盤は馬作り（2d3e）から飛・金連打で収束すると見られ、原典照合未了のため主題の断定は留保する。"
  ]
}
