{
  "id": "musou-049",
  "collection_id": "musou",
  "number": 49,
  "title": null,
  "author": "三代伊藤宗看",
  "published_year": 1734,
  "period": "Edo",
  "sfen": "nn3B3/2Pp3r1/S1p1B4/s2Pp4/L1k6/2+p6/5+r3/9/3L5 b G3g2s2n2l12p 1",
  "corrected_sfen": null,
  "correction_note": null,
  "solution_usi": [
    "G*8e",
    "9d8e",
    "6d6c",
    "7e7d",
    "6c6b",
    "4g4a",
    "5c6d+",
    "7d8c",
    "P*8d",
    "8c7b",
    "6d5d",
    "7b7a",
    "6b6a+",
    "4a6a",
    "P*7b",
    "2b7b",
    "5d7b",
    "6a7b",
    "9c8b+",
    "7a8b",
    "R*9b",
    "8b7a",
    "9b7b+",
    "7a7b",
    "R*5b",
    "7b7a",
    "5b6b+"
  ],
  "solution_moves": 27,
  "status": {
    "position_verified": true,
    "solution_verified": true,
    "unique_solution_verified": false
  },
  "verification": {
    "method": "reference-KIF collation + engine check: SFEN parse, inventory, nifu, full solution legality with continuous check, final mate with complete reply generation (tools/validate.py)",
    "tool": "tools/kif2open.py + tools/validate.py",
    "checked_date": "2026-09-16",
    "transcribed_by": "edo_era_tsume_shogi maintainers",
    "transcribed_from": "Stage-1 reference transcription (board facts and main-line moves only, mechanically transcribed; third-party reference, URL withheld per project policy). Original archive scans NOT yet collated.",
    "transcribed_date": "2026-09-15",
    "reference_urls": [],
    "needs_manual_review": true
  },
  "source": {
    "title": "象戯作物（俗称：将棋無双）",
    "repository": "国立国会図書館",
    "identifier": "NDLBibID:000001281469 / 請求記号:W431-4（享保19年版の復製）",
    "page": null,
    "url": "https://ndlsearch.ndl.go.jp/books/R100000002-I000001281469",
    "edition": "享保19年版の復製（1970年古棋書復刻委員会版）。伝本により図に異同あり。未照合。"
  },
  "rights": {
    "original_work": "Public Domain",
    "dataset_record": "CC0-1.0"
  },
  "features": {},
  "notes": [
    "参考KIFの申告手数: 27手",
    "本レコードの盤面・解答は照合用参考KIFからの機械的転記であり、原典（NDL所蔵『象戯作物』享保19年版の復製）画像との照合は未了。参考資料の解説文等は一切取り込んでいない。無双は伝本により図に異同があることが知られており、版の特定も今後の課題。"
  ]
}
