{
  "id": "zukou-012",
  "collection_id": "zukou",
  "number": 12,
  "title": null,
  "author": "伊藤看寿",
  "published_year": 1755,
  "period": "Edo",
  "sfen": "5+rl1s/7k1/8n/6p1+B/9/9/9/9/9 b R2NPb4g3sn3l16p 1",
  "corrected_sfen": null,
  "correction_note": null,
  "solution_usi": [
    "R*2c",
    "2b3b",
    "2c1c",
    "3b2a",
    "1c2c",
    "1a2b",
    "N*1c",
    "2a1a",
    "P*1b",
    "1a1b",
    "N*2d",
    "1b1a",
    "1c2a+",
    "1a2a",
    "N*3c",
    "2a1a",
    "2d1b+",
    "1a1b",
    "1d1c",
    "2b1c",
    "2c2a+"
  ],
  "solution_moves": 21,
  "status": {
    "position_verified": true,
    "solution_verified": true,
    "unique_solution_verified": false
  },
  "verification": {
    "method": "reference-KIF collation + engine check: SFEN parse, inventory, nifu, full solution legality with continuous check, final mate with complete reply generation (tools/validate.py)",
    "tool": "tools/kif2open.py + tools/validate.py",
    "checked_date": "2026-09-16",
    "transcribed_by": "edo_era_tsume_shogi maintainers",
    "transcribed_from": "Stage-1 reference transcription (board facts and main-line moves only, mechanically transcribed; third-party reference, URL withheld per project policy). Original archive scans NOT yet collated.",
    "transcribed_date": "2026-09-15",
    "reference_urls": [],
    "needs_manual_review": true
  },
  "source": {
    "title": "将棋図巧",
    "repository": "国立国会図書館",
    "identifier": "NDLBibID:000000493927 / 請求記号:209-461",
    "page": null,
    "url": "https://ndlsearch.ndl.go.jp/books/R100000002-I000000493927",
    "edition": null
  },
  "rights": {
    "original_work": "Public Domain",
    "dataset_record": "CC0-1.0"
  },
  "features": {},
  "notes": [
    "参考KIFの申告手数: 21手",
    "本レコードの盤面・解答は照合用参考KIFからの機械的転記であり、原典（NDL所蔵『将棋図巧・将棋図巧詰手』）画像との照合は未了。参考資料の解説文・着想点等は一切取り込んでいない。"
  ]
}
