{
  "id": "musou-057",
  "collection_id": "musou",
  "number": 57,
  "title": null,
  "author": "三代伊藤宗看",
  "published_year": 1734,
  "period": "Edo",
  "sfen": "1n1n5/4+B+r3/np1lp4/p1p6/1k2l4/3N5/1PP6/5+B3/5+r3 b GS3g3s2l12p 1",
  "corrected_sfen": null,
  "correction_note": null,
  "solution_usi": [
    "4h4i",
    "8e8d",
    "S*7e",
    "8d7e",
    "4i7f",
    "7e8d",
    "G*7e",
    "8d7c",
    "7e6d",
    "6c6d",
    "R*6c",
    "7c8d",
    "7f7e",
    "8d9e",
    "7e8f",
    "9e8d",
    "6c7c+",
    "8d7c",
    "8f6d",
    "7c7b",
    "5b6c",
    "7b7a",
    "L*7b",
    "4b7b",
    "6c7b",
    "7a7b",
    "R*9b",
    "7b7a",
    "9b8b+"
  ],
  "solution_moves": 29,
  "status": {
    "position_verified": true,
    "solution_verified": true,
    "unique_solution_verified": false
  },
  "verification": {
    "method": "reference-KIF collation + engine check: SFEN parse, inventory, nifu, full solution legality with continuous check, final mate with complete reply generation (tools/validate.py)",
    "tool": "tools/kif2open.py + tools/validate.py",
    "checked_date": "2026-09-16",
    "transcribed_by": "open-tsume maintainers",
    "transcribed_from": "mechanical transcription of board facts and main-line moves from collation-reference KIF (http://park6.wakwak.com/~k-oohasi/shougi/html/musou/musou00.html); original archive scans NOT yet collated",
    "transcribed_date": "2026-09-15",
    "reference_urls": [
      "http://park6.wakwak.com/~k-oohasi/shougi/html/musou/musou00.html"
    ],
    "needs_manual_review": true
  },
  "source": {
    "title": "象戯作物（俗称：将棋無双）",
    "repository": "国立国会図書館",
    "identifier": "NDLBibID:000001281469 / 請求記号:W431-4（享保19年版の復製）",
    "page": null,
    "url": "https://ndlsearch.ndl.go.jp/books/R100000002-I000001281469",
    "edition": "享保19年版の復製（1970年古棋書復刻委員会版）。伝本により図に異同あり。未照合。"
  },
  "rights": {
    "original_work": "Public Domain",
    "dataset_record": "CC0-1.0"
  },
  "features": {},
  "notes": [
    "参考KIFの申告手数: 29手",
    "本レコードの盤面・解答は照合用参考KIFからの機械的転記であり、原典（NDL所蔵『象戯作物』享保19年版の復製）画像との照合は未了。参考資料の解説文等は一切取り込んでいない。無双は伝本により図に異同があることが知られており、版の特定も今後の課題。"
  ]
}
