{
  "id": "musou-089",
  "collection_id": "musou",
  "number": 89,
  "title": null,
  "author": "三代伊藤宗看",
  "published_year": 1734,
  "period": "Edo",
  "sfen": "3S1+N3/p5pll/4p3n/4s4/+pS5n1/2+bp2P1N/+R1S3B2/R1+p1P2p1/2k2P2P b 3P4g2l4p 1",
  "corrected_sfen": null,
  "correction_note": null,
  "solution_usi": [
    "9h7h",
    "7i7h",
    "9g8h",
    "7h6g",
    "8h6h",
    "6g5f",
    "6h5g",
    "5f4e",
    "5g4f",
    "4e3d",
    "4f3e",
    "3d4c",
    "6a5b",
    "4c5b",
    "3e3b",
    "5b6c",
    "P*6d",
    "6c7c",
    "P*7d",
    "7c8c",
    "P*8d",
    "8c9c",
    "P*9d",
    "9e9d",
    "8d8c+",
    "9c8c",
    "7d7c+",
    "8c7c",
    "6d6c+",
    "7c6c",
    "8e7d",
    "6c7d",
    "3b7b",
    "7d6e",
    "7b7f",
    "6e5f",
    "7f6f",
    "5f4g",
    "6f5g",
    "4g3h",
    "5g4h",
    "3h2g",
    "B*3h",
    "2g1g",
    "1i1h",
    "1g1h",
    "3h2i",
    "1h2g",
    "2i1h",
    "2g1f",
    "1h2g",
    "1f2g",
    "4h2h",
    "2g3f",
    "2h2f",
    "3f4e",
    "2f4f",
    "4e3d",
    "P*3e",
    "3d3c",
    "4f4b",
    "3c2c",
    "P*2d",
    "2c1d",
    "P*1e",
    "1d2d",
    "4b4d",
    "2d2c",
    "4d3d"
  ],
  "solution_moves": 69,
  "status": {
    "position_verified": true,
    "solution_verified": true,
    "unique_solution_verified": false
  },
  "verification": {
    "method": "reference-KIF collation + engine check: SFEN parse, inventory, nifu, full solution legality with continuous check, final mate with complete reply generation (tools/validate.py)",
    "tool": "tools/kif2open.py + tools/validate.py",
    "checked_date": "2026-09-16",
    "transcribed_by": "open-tsume maintainers",
    "transcribed_from": "mechanical transcription of board facts and main-line moves from collation-reference KIF (http://park6.wakwak.com/~k-oohasi/shougi/html/musou/musou00.html); original archive scans NOT yet collated",
    "transcribed_date": "2026-09-15",
    "reference_urls": [
      "http://park6.wakwak.com/~k-oohasi/shougi/html/musou/musou00.html"
    ],
    "needs_manual_review": true
  },
  "source": {
    "title": "象戯作物（俗称：将棋無双）",
    "repository": "国立国会図書館",
    "identifier": "NDLBibID:000001281469 / 請求記号:W431-4（享保19年版の復製）",
    "page": null,
    "url": "https://ndlsearch.ndl.go.jp/books/R100000002-I000001281469",
    "edition": "享保19年版の復製（1970年古棋書復刻委員会版）。伝本により図に異同あり。未照合。"
  },
  "rights": {
    "original_work": "Public Domain",
    "dataset_record": "CC0-1.0"
  },
  "features": {},
  "notes": [
    "参考KIFの申告手数: 69手",
    "本レコードの盤面・解答は照合用参考KIFからの機械的転記であり、原典（NDL所蔵『象戯作物』享保19年版の復製）画像との照合は未了。参考資料の解説文等は一切取り込んでいない。無双は伝本により図に異同があることが知られており、版の特定も今後の課題。"
  ]
}
