{
  "id": "musou-080",
  "collection_id": "musou",
  "number": 80,
  "title": null,
  "author": "三代伊藤宗看",
  "published_year": 1734,
  "period": "Edo",
  "sfen": "9/3p1n2s/8G/4p1S2/5s3/2P4b+p/3+RLk+l2/9/1+B1s2G2 b RN2g2n2l14p 1",
  "corrected_sfen": null,
  "correction_note": null,
  "solution_usi": [
    "R*4f",
    "4e4f",
    "6g5f",
    "4g3f",
    "5f4g",
    "3f3e",
    "4g3f",
    "3g3f",
    "8i4e",
    "3e2d",
    "1c1d",
    "2d1d",
    "4e3f",
    "1d2d",
    "3f2e",
    "2d1c",
    "L*1d",
    "1c2b",
    "1d1b+",
    "2b1b",
    "N*2d",
    "1b2a",
    "S*3b",
    "2a1a",
    "2d1b+",
    "1a1b",
    "3d2c",
    "1b1a",
    "3b2a+",
    "1a2a",
    "2e4c",
    "2a1a",
    "4c3c",
    "1a2a",
    "3c2b"
  ],
  "solution_moves": 35,
  "status": {
    "position_verified": true,
    "solution_verified": true,
    "unique_solution_verified": false
  },
  "verification": {
    "method": "reference-KIF collation + engine check: SFEN parse, inventory, nifu, full solution legality with continuous check, final mate with complete reply generation (tools/validate.py) + solver crosscheck (YaneuraOuMateEngine 9.80git): 完全解探索で37手（現記録35手と不一致）、solution_usi不変",
    "tool": "tools/kif2open.py + tools/validate.py",
    "checked_date": "2026-09-16",
    "transcribed_by": "edo_era_tsume_shogi maintainers",
    "transcribed_from": "Stage-1 reference transcription (board facts and main-line moves only, mechanically transcribed; third-party reference, URL withheld per project policy). Original archive scans NOT yet collated.",
    "transcribed_date": "2026-09-15",
    "reference_urls": [],
    "needs_manual_review": true
  },
  "source": {
    "title": "象戯作物（俗称：将棋無双）",
    "repository": "国立国会図書館",
    "identifier": "NDLBibID:000001281469 / 請求記号:W431-4（享保19年版の復製）",
    "page": null,
    "url": "https://ndlsearch.ndl.go.jp/books/R100000002-I000001281469",
    "edition": "享保19年版の復製（1970年古棋書復刻委員会版）。伝本により図に異同あり。未照合。"
  },
  "rights": {
    "original_work": "Public Domain",
    "dataset_record": "CC0-1.0"
  },
  "features": {},
  "notes": [
    "参考KIFの申告手数: 35手",
    "本レコードの盤面・解答は照合用参考KIFからの機械的転記であり、原典（NDL所蔵『象戯作物』享保19年版の復製）画像との照合は未了。参考資料の解説文等は一切取り込んでいない。無双は伝本により図に異同があることが知られており、版の特定も今後の課題。",
    "solver crosscheck (YaneuraOuMateEngine 9.80git): 完全解探索で37手（現記録35手と不一致）。solution_usi不変。",
    "解説：35手の手順で、序盤は飛捨て（R*4f）から銀・金の往復へ進むと見られる。中盤は角の転換（8i4e）と香打ち（L*1d）・香成（1d1b+）を交えると見られる。終盤は桂・銀の連打から銀の引き戻し（3c2b）で収束すると見られ、原典照合未了のため主題の断定は留保する。"
  ]
}
